{
  "schema_version": 1,
  "event_id": "3e4f5a6b-7c8d-4e9f-8a0b-1c2d3e4f5a6b",
  "kind": "blocked",
  "host_id": "laptop",
  "session_id": "019a2f00-0000-7000-8000-000000000001",
  "cwd": "/home/user/dev/example",
  "at": "2026-10-30T05:15:00Z",
  "reason": "git push blocked: no PASS review for commit 1a2b3c4."
}
