{
  "schema_version": 1,
  "event_id": "0b1c2d3e-4f5a-4b6c-8d7e-9f0a1b2c3d4e",
  "kind": "ended",
  "host_id": "laptop",
  "session_id": "019a2f00-0000-7000-8000-000000000001",
  "cwd": "/home/user/dev/example",
  "at": "2026-10-30T05:20:00Z",
  "summary": "All 42 tests pass. Changed src/auth.ts."
}
