{
  "schema_version": 1,
  "event_id": "2d3e4f5a-6b7c-4d8e-9f0a-1b2c3d4e5f6a",
  "kind": "asked",
  "host_id": "laptop",
  "session_id": "019a2f00-0000-7000-8000-000000000001",
  "cwd": "/home/user/dev/example",
  "at": "2026-10-30T05:11:00Z",
  "question": {
    "id": "c1d2e3f4-a5b6-4c7d-9e8f-0a1b2c3d4e5f",
    "text": "Two fixes are possible. Which one?",
    "choices": [
      "Option A: patch the caller",
      "Option B: change the API"
    ],
    "timeout_s": 1800
  }
}
